{
  "alternatives": [
    {
      "id": "entity-graph-lexical",
      "label": "entity-graph / Lexical",
      "metrics": {
        "mrr_at_10": 60.77777777777777,
        "ndcg_at_10": 59.40418860485238,
        "p95_ms": 83.1696999957785,
        "recall_at_10": 63.73015873015873
      }
    },
    {
      "id": "embeddings-lexical",
      "label": "embeddings / Lexical",
      "metrics": {
        "mrr_at_10": 61.5,
        "ndcg_at_10": 59.066918081551044,
        "p95_ms": 10.284900024998933,
        "recall_at_10": 61.85515873015872
      }
    },
    {
      "id": "classical-bm25",
      "label": "classical / BM25",
      "metrics": {
        "mrr_at_10": 60.56250000000001,
        "ndcg_at_10": 58.9027672187069,
        "p95_ms": 38.786199991591275,
        "recall_at_10": 64.56349206349206
      }
    },
    {
      "id": "legacy-lexical",
      "label": "legacy / Lexical",
      "metrics": {
        "mrr_at_10": 59.86111111111111,
        "ndcg_at_10": 57.496953757228944,
        "p95_ms": 3.5666999756358564,
        "recall_at_10": 61.92460317460318
      }
    },
    {
      "id": "ensemble-quality",
      "label": "ensemble / Quality",
      "metrics": {
        "mrr_at_10": 60.357142857142854,
        "ndcg_at_10": 55.379412585725454,
        "p95_ms": 1315.9202999668196,
        "recall_at_10": 58.99801587301587
      }
    },
    {
      "id": "ensemble-fast",
      "label": "ensemble / Fast",
      "metrics": {
        "mrr_at_10": 59.06944444444444,
        "ndcg_at_10": 52.294145469982624,
        "p95_ms": 1224.4053999893367,
        "recall_at_10": 58.99801587301587
      }
    },
    {
      "id": "embeddings-hybrid",
      "label": "embeddings / Hybrid",
      "metrics": {
        "mrr_at_10": 53.96527777777778,
        "ndcg_at_10": 51.47104759345517,
        "p95_ms": 47.65860002953559,
        "recall_at_10": 59.910714285714285
      }
    },
    {
      "id": "adaptive-adaptive-fusion",
      "label": "adaptive / Adaptive fusion",
      "metrics": {
        "mrr_at_10": 57.472222222222214,
        "ndcg_at_10": 50.33603261131847,
        "p95_ms": 1190.7689999789,
        "recall_at_10": 58.99801587301587
      }
    },
    {
      "id": "ensemble-robust",
      "label": "ensemble / Robust",
      "metrics": {
        "mrr_at_10": 57.472222222222214,
        "ndcg_at_10": 50.33603261131847,
        "p95_ms": 1141.874800028745,
        "recall_at_10": 58.99801587301587
      }
    },
    {
      "id": "classical-association",
      "label": "classical / Association",
      "metrics": {
        "mrr_at_10": 56.25,
        "ndcg_at_10": 47.214908122362345,
        "p95_ms": 43.3560999808833,
        "recall_at_10": 45.863095238095234
      }
    },
    {
      "id": "entity-graph-fusion",
      "label": "entity-graph / Fusion",
      "metrics": {
        "mrr_at_10": 47.333333333333336,
        "ndcg_at_10": 46.73466879301481,
        "p95_ms": 92.51759998733178,
        "recall_at_10": 58.03571428571429
      }
    },
    {
      "id": "classical-topic",
      "label": "classical / Topic",
      "metrics": {
        "mrr_at_10": 55.00000000000001,
        "ndcg_at_10": 46.47058008261054,
        "p95_ms": 39.6828000084497,
        "recall_at_10": 45.863095238095234
      }
    },
    {
      "id": "entity-graph-entity",
      "label": "entity-graph / Entity",
      "metrics": {
        "mrr_at_10": 46.673611111111114,
        "ndcg_at_10": 45.252827908377355,
        "p95_ms": 82.74820004589856,
        "recall_at_10": 56.57738095238095
      }
    },
    {
      "id": "classical-fusion",
      "label": "classical / Fusion",
      "metrics": {
        "mrr_at_10": 56.25,
        "ndcg_at_10": 43.42376729604631,
        "p95_ms": 41.141800000332296,
        "recall_at_10": 42.46031746031746
      }
    },
    {
      "id": "entity-graph-traversal",
      "label": "entity-graph / Traversal",
      "metrics": {
        "mrr_at_10": 46.04166666666667,
        "ndcg_at_10": 43.274149507640914,
        "p95_ms": 82.56619999883696,
        "recall_at_10": 50.32738095238095
      }
    },
    {
      "id": "turso-lexical-sql-comparator",
      "label": "turso / Lexical SQL comparator",
      "metrics": {
        "mrr_at_10": 40.854166666666664,
        "ndcg_at_10": 40.319114502840776,
        "p95_ms": 52.03550000442192,
        "recall_at_10": 49.87103174603175
      }
    },
    {
      "id": "embeddings-vector",
      "label": "embeddings / Vector",
      "metrics": {
        "mrr_at_10": 37.797619047619044,
        "ndcg_at_10": 32.638974172822834,
        "p95_ms": 34.756500041112304,
        "recall_at_10": 36.92460317460318
      }
    },
    {
      "id": "graphify-graph-search",
      "label": "graphify / Graph search",
      "metrics": {
        "mrr_at_10": 20.42361111111111,
        "ndcg_at_10": 13.626228624863055,
        "p95_ms": 128.3024000003934,
        "recall_at_10": 17.371031746031747
      }
    }
  ],
  "dataset_scope": {
    "candidate_budget": "top-10",
    "cohort": "published-source-cohort",
    "dataset_id": "enterprise-rag-bench-40-v1",
    "identity_grouping": "as-defined-by-bound-source-report",
    "metric_contract": "published-aggregate-sha256:23c451906b6195575eb716f9d86a387874d5a90af97ee3ab7303a65b8745b6ab"
  },
  "heading": "## Direct comparison",
  "metrics": [
    {
      "aggregation": "mean",
      "direction": "higher",
      "display_precision": 2,
      "id": "ndcg_at_10",
      "label": "nDCG@10",
      "unit": "percent"
    },
    {
      "aggregation": "mean",
      "direction": "higher",
      "display_precision": 2,
      "id": "recall_at_10",
      "label": "Recall@10",
      "unit": "percent"
    },
    {
      "aggregation": "mean",
      "direction": "higher",
      "display_precision": 2,
      "id": "mrr_at_10",
      "label": "MRR@10",
      "unit": "percent"
    },
    {
      "aggregation": "percentile_95",
      "direction": "lower",
      "display_precision": 2,
      "id": "p95_ms",
      "label": "P95 (ms)",
      "unit": "ms"
    }
  ],
  "report": "final-report.md",
  "schema_version": "final-report-comparison/1.0"
}
